{
  "version": "1.2",
  "contract": {
    "artifact": "visual_direction_contract",
    "artifact_id": "ai-capital-flow-mortgage-ko/visual-direction",
    "revision": 1,
    "fingerprint": "sha256:7047616a43079b6e2e2403cfcefec81cc83ac13c3266091655b901c3ecd52421"
  },
  "timeline_sha256": "4331fde20bd7b8d9ccfbc7a6fd4b36b60b176fb4f9b363cca181b05d137f3e16",
  "edit_decisions_sha256": "a947148179892efdffef6e1b7a77bc10badd3ff6894e0e8eff5a6b4b156727c5",
  "scene_windows": [
    {
      "production_scene_id": "sc15",
      "start_seconds": 0.0,
      "end_seconds": 8.36,
      "cut_ids": [
        "c-sc15"
      ]
    },
    {
      "production_scene_id": "sc16",
      "start_seconds": 8.36,
      "end_seconds": 12.92,
      "cut_ids": [
        "c-sc16"
      ]
    },
    {
      "production_scene_id": "sc17",
      "start_seconds": 12.92,
      "end_seconds": 17.06,
      "cut_ids": [
        "c-sc17"
      ]
    },
    {
      "production_scene_id": "sc18",
      "start_seconds": 17.06,
      "end_seconds": 21.2,
      "cut_ids": [
        "c-sc18"
      ]
    },
    {
      "production_scene_id": "sc19",
      "start_seconds": 21.2,
      "end_seconds": 24.6,
      "cut_ids": [
        "c-sc19"
      ]
    }
  ],
  "bindings": [
    {
      "binding_id": "sc15/deterministic_graphics",
      "production_scene_id": "sc15",
      "layer": "deterministic_graphics",
      "runtime": "remotion_atelier",
      "consumes": {
        "action_ids": [
          "SC009/A01"
        ],
        "event_ids": [
          "SC009/E01"
        ],
        "state_ids": [
          "SC009/S0",
          "SC009/S1"
        ]
      },
      "timeline_event_ids": [
        "ev-sc15-b1",
        "ev-sc15-b2"
      ],
      "start_seconds": 5.06,
      "end_seconds": 6.26,
      "locator": {
        "kind": "CODE",
        "implementation_path": "index.tsx",
        "component_or_block": "CapitalFlow",
        "refs": [
          {
            "file": "CapitalFlow.tsx",
            "line": 5,
            "symbol": "CapitalFlow",
            "via": "useEventProgress"
          },
          {
            "file": "CapitalFlow.tsx",
            "line": 6,
            "symbol": "CapitalFlow",
            "via": "useEventProgress"
          }
        ]
      },
      "status": "bound"
    },
    {
      "binding_id": "sc16/deterministic_graphics",
      "production_scene_id": "sc16",
      "layer": "deterministic_graphics",
      "runtime": "remotion_atelier",
      "consumes": {
        "action_ids": [
          "SC009/A02"
        ],
        "event_ids": [
          "SC009/E02"
        ],
        "state_ids": [
          "SC009/S2"
        ]
      },
      "timeline_event_ids": [
        "ev-sc16-b1",
        "ev-sc16-b2",
        "ev-sc16-b3",
        "ev-sc16-b4",
        "ev-sc16-b5"
      ],
      "start_seconds": 8.36,
      "end_seconds": 12.08,
      "locator": {
        "kind": "CODE",
        "implementation_path": "index.tsx",
        "component_or_block": "CapitalFlow",
        "refs": [
          {
            "file": "CapitalFlow.tsx",
            "line": 7,
            "symbol": "CapitalFlow",
            "via": "useEventProgress"
          },
          {
            "file": "CapitalFlow.tsx",
            "line": 8,
            "symbol": "CapitalFlow",
            "via": "useEventProgress"
          },
          {
            "file": "CapitalFlow.tsx",
            "line": 9,
            "symbol": "CapitalFlow",
            "via": "useEventProgress"
          },
          {
            "file": "CapitalFlow.tsx",
            "line": 10,
            "symbol": "CapitalFlow",
            "via": "useEventProgress"
          },
          {
            "file": "CapitalFlow.tsx",
            "line": 11,
            "symbol": "CapitalFlow",
            "via": "useEventProgress"
          }
        ]
      },
      "status": "bound"
    },
    {
      "binding_id": "sc17/deterministic_graphics",
      "production_scene_id": "sc17",
      "layer": "deterministic_graphics",
      "runtime": "remotion_atelier",
      "consumes": {
        "action_ids": [
          "SC009/A03"
        ],
        "event_ids": [
          "SC009/E03"
        ],
        "state_ids": [
          "SC009/S3"
        ]
      },
      "timeline_event_ids": [
        "ev-sc17-b1",
        "ev-sc17-b2"
      ],
      "start_seconds": 13.76,
      "end_seconds": 15.46,
      "locator": {
        "kind": "CODE",
        "implementation_path": "index.tsx",
        "component_or_block": "CapitalFlow",
        "refs": [
          {
            "file": "CapitalFlow.tsx",
            "line": 12,
            "symbol": "CapitalFlow",
            "via": "useEventProgress"
          },
          {
            "file": "CapitalFlow.tsx",
            "line": 13,
            "symbol": "CapitalFlow",
            "via": "useEventProgress"
          }
        ]
      },
      "status": "bound"
    },
    {
      "binding_id": "sc18/factual_source",
      "production_scene_id": "sc18",
      "layer": "factual_source",
      "runtime": "remotion_atelier",
      "consumes": {
        "state_ids": [
          "SC010/S0"
        ]
      },
      "locator": {
        "kind": "ASSET",
        "cut_id": "c-sc18",
        "source_asset_ref": "assets/evidence/kb_rate_table_capture.png",
        "via": "edit_decisions.cut",
        "in_seconds": 17.06,
        "out_seconds": 21.2
      },
      "start_seconds": 17.06,
      "end_seconds": 21.2,
      "status": "bound"
    }
  ],
  "events": [
    {
      "event_id": "ev-sc15-b1",
      "production_scene_id": "sc15",
      "runtime": "remotion_atelier",
      "time_seconds": 5.06,
      "implemented": true,
      "refs": [
        {
          "file": "CapitalFlow.tsx",
          "line": 5,
          "symbol": "CapitalFlow",
          "via": "useEventProgress"
        }
      ],
      "action_id": "SC009/A01",
      "contract_event_id": "SC009/E01",
      "layer": "deterministic_graphics"
    },
    {
      "event_id": "ev-sc15-b2",
      "production_scene_id": "sc15",
      "runtime": "remotion_atelier",
      "time_seconds": 5.46,
      "implemented": true,
      "refs": [
        {
          "file": "CapitalFlow.tsx",
          "line": 6,
          "symbol": "CapitalFlow",
          "via": "useEventProgress"
        }
      ],
      "action_id": "SC009/A01",
      "contract_event_id": "SC009/E01",
      "layer": "deterministic_graphics"
    },
    {
      "event_id": "ev-sc16-b1",
      "production_scene_id": "sc16",
      "runtime": "remotion_atelier",
      "time_seconds": 8.36,
      "implemented": true,
      "refs": [
        {
          "file": "CapitalFlow.tsx",
          "line": 7,
          "symbol": "CapitalFlow",
          "via": "useEventProgress"
        }
      ],
      "action_id": "SC009/A02",
      "contract_event_id": "SC009/E02",
      "layer": "deterministic_graphics"
    },
    {
      "event_id": "ev-sc16-b2",
      "production_scene_id": "sc16",
      "runtime": "remotion_atelier",
      "time_seconds": 8.36,
      "implemented": true,
      "refs": [
        {
          "file": "CapitalFlow.tsx",
          "line": 8,
          "symbol": "CapitalFlow",
          "via": "useEventProgress"
        }
      ],
      "action_id": "SC009/A02",
      "contract_event_id": "SC009/E02",
      "layer": "deterministic_graphics"
    },
    {
      "event_id": "ev-sc16-b3",
      "production_scene_id": "sc16",
      "runtime": "remotion_atelier",
      "time_seconds": 10.88,
      "implemented": true,
      "refs": [
        {
          "file": "CapitalFlow.tsx",
          "line": 9,
          "symbol": "CapitalFlow",
          "via": "useEventProgress"
        }
      ],
      "action_id": "SC009/A02",
      "contract_event_id": "SC009/E02",
      "layer": "deterministic_graphics"
    },
    {
      "event_id": "ev-sc16-b4",
      "production_scene_id": "sc16",
      "runtime": "remotion_atelier",
      "time_seconds": 10.88,
      "implemented": true,
      "refs": [
        {
          "file": "CapitalFlow.tsx",
          "line": 10,
          "symbol": "CapitalFlow",
          "via": "useEventProgress"
        }
      ],
      "action_id": "SC009/A02",
      "contract_event_id": "SC009/E02",
      "layer": "deterministic_graphics"
    },
    {
      "event_id": "ev-sc16-b5",
      "production_scene_id": "sc16",
      "runtime": "remotion_atelier",
      "time_seconds": 10.88,
      "implemented": true,
      "refs": [
        {
          "file": "CapitalFlow.tsx",
          "line": 11,
          "symbol": "CapitalFlow",
          "via": "useEventProgress"
        }
      ],
      "action_id": "SC009/A02",
      "contract_event_id": "SC009/E02",
      "layer": "deterministic_graphics"
    },
    {
      "event_id": "ev-sc17-b1",
      "production_scene_id": "sc17",
      "runtime": "remotion_atelier",
      "time_seconds": 13.76,
      "implemented": true,
      "refs": [
        {
          "file": "CapitalFlow.tsx",
          "line": 12,
          "symbol": "CapitalFlow",
          "via": "useEventProgress"
        }
      ],
      "action_id": "SC009/A03",
      "contract_event_id": "SC009/E03",
      "layer": "deterministic_graphics"
    },
    {
      "event_id": "ev-sc17-b2",
      "production_scene_id": "sc17",
      "runtime": "remotion_atelier",
      "time_seconds": 14.26,
      "implemented": true,
      "refs": [
        {
          "file": "CapitalFlow.tsx",
          "line": 13,
          "symbol": "CapitalFlow",
          "via": "useEventProgress"
        }
      ],
      "action_id": "SC009/A03",
      "contract_event_id": "SC009/E03",
      "layer": "deterministic_graphics"
    }
  ],
  "trace_sources": [
    {
      "layer": "deterministic_graphics",
      "runtime": "remotion_atelier",
      "source": "index.tsx",
      "hard_failures": []
    },
    {
      "layer": "factual_source",
      "runtime": "remotion_atelier",
      "source": "edit_decisions"
    }
  ]
}
